Текст отзыва,Полезность (количество минусов),Не устраивает качество товара,Не устраивает цена товара,Брак заводской / брак в результате транспортировки
"Нитки пришли в количестве 3 шт, отказ. Считаю данного продавца не добросовестным. Ранее были отзывы, и много о том, что от даного продавца приходят пряжа не в полном объеме. Продавец до сих пор не принял никаих мер. Он теряет время покупателей. Не рекомендую его",1,0,0,0
"Звезду снимаю за то что немного цвет темнее,чем на фото. Пряжа пришла быстро!",1,0,0,0
Цвет грязный не соответствует картинке сплошное разчарование,1,0,0,0
"Номер 47- пряжа хорошая, но сами мотки из разных партий пряжи.",1,0,0,0
Упаковка вскрыта. Один моток из двух украден.,1,0,0,0
"Цвет соответствует, очень мягкая !",1,0,0,0
"Цвет на самом дела оказался ярким, типа ярко-розовой фуксии. Поэтому отказ",1,0,0,0
"Пришла партия другого цвета, которая дешевле заказанной, но деньги взяли как за более дорогой товар. Вот и думай: то ли случайно, то ли преднамеренно. Ещё и за возврат 50 руб. сняли. За что?!!",1,0,0,0
"Пряжа отличная, но одна упаковка вскрыта , а другая- вместо 08 тона вложили 18- от этой упаковки отказалась, а ценник уже подняли.",1,0,0,0
"Цвет конечно не тот!! Обидно, ждала эту пряжу. Но всё равно оставила.",1,0,0,0
Вместо 5 мотков пришло только 3 мотка,1,0,0,0
"Мне понравилась пряжа! Правда при вязании из середины мотка путалась, а вернее длинными ворсинками спутывалась ,но легко можно разделить! При стирке запах шерсти! После высыхания все норм, нет запаха! Спасибо! Цвета очень нравятся!!",1,0,0,0
Доставили быстро. Цвет соответствует картинке.,1,0,0,0
"Смешно, конечно, но я связала шапку, и только потом поняла, что прислали другую пряжу, Drops Nepal mix. Цвет похожий, вот и взяла не рассматривая.",1,0,0,0
"заказывала мятный , пришел цвет темно-зеленый с сиеватым отлтвом. отказ",1,0,0,0
"Шикарная пряжа, цвет лаванда, паутинка получилась невесомая, а сама кофточка нежная и тëплая✅👍 заказала ещё в цвете мурена💞 цена адекватная
Спасибо!",1,0,0,0
"В упаковке пришло 3 мотка вместо 4, возврат.",1,0,0,0
Доставлен в пленке-пупырке цел без потеков.,1,0,0,0
"Пряжа понравилась, не знаю как в работе, но почему-то и кто- распаковывал, не знаюгде и на каком уровне занимаются этим , но очень неприятно!",1,0,0,0
"Пришел хорошо упакованный , ничего не счиплет никакого покалывания ,без запаха , как воду на голову нанесла , масло вообще не впитывается все стикает !подделка!!!!",1,0,0,0
Масло очень понравилось. Наносила когда болела голова. Помогло. Смывается хорошо.,1,0,0,0
"Чудо как хороша👍, на тёплую шапку поженила мохерчик с альпакой. Уже сейчас видно облако нежное, а уж после стирки....",1,0,0,0
"Очень мягкая, нежнейшая ниточка. Рекомендую!",1,0,0,0
Пришел со сломаным дозатором,1,0,0,0
"цвет 01, скорее молочный, чем белый, пришли хорошо упакованые 2 комплекта по 4 моточка, мягкие, вообще не колючие. Дропс мохер с шелком, ещё и альпаку Flora я уже опробовала,прекрасно себя ведут в глади, надеюсь эти тоже порадуют.",1,0,0,0
"Очень разочарована....Сама работа получилась красивая,бисера хватило.Что то с канвой не то.Впервые с таким столкнулась,после окончания работы стал виден перекос,правый нижний угол вниз ушел.Не рекомендую к покупке.",1,0,0,0
"Добрый день! 
Сразу заказала две упаковки по четыре моточка. Пришла только одна... Хорошо оплата по факту! В чём дело? Ждем вторую половину?",1,0,0,0
"Потрясающая пряжа. Приехал полный комплект, аккуратно упакован в зип-лок и дополнительно заклеен бумажным стикером. Моточки для своего веса объемные, один к одному, мягенькие. Цвет чуть темнее, теплее и натуральнее, чем на фото; мне так даже больше понравилось. Узлов пока не встретилось. Пушистость неравномерная, но на изделии незаметно. Вяжется легко, но распустить уже не получится. Пух не лезет. Вяжу в две нити крючком, резинку - 5мм, полотно - 6мм. Не просвечивает, очень тёплое, как будто сама пряжа выделяет тепло. Снаружи хорошо видно рельеф, шёлк чуть поблескивает. Изнутри образуется что-то вроде подкладки из пуха, мягкое, как пузико котёнка:) кошке, к сожалению, тоже понравилось: утыкается носом и впивается когтями так, что не отнять, приходится закрываться от неё, чтоб повязать:) это говорит о том, что пряжа действительно очень натуральная и ничем не обработана. Денег своих однозначно стоит, буду покупать остальные цвета:)",1,0,0,0
"Цвет 01., скорее молочный, вязаная в 1 нить на спицах 4,5, ушло 6 моточков. Изделие лёгкое, тёплое, приятно к телу, я довольна.",1,0,0,0
"Мне не понравилась смотрела внимательно фото с отзывами ровная пряжа, а мне пришла не равномерная на нитке то густо то пусто,из такой точнто  не свяжешь паутинку , угораздило заказать 8 шт, распечатала только дома тк было много народа в пункте выдачи, теперь не знаю как быть с этой покупкой",1,0,0,0
"Вместо овощной бульон,  пришёл уцхо-сунели",1,0,0,0
"Цветовая последовательность клубков нарушена. Чтобы подобрать узор придется подумать,как все это будет смотрется.",1,0,0,0
"Отличная вышивка, вышивать несложно, рекомендую леской",1,0,0,0
О результате говорить рано.,1,0,0,0
"Связала. Нет, что то мне не нравится. Мягкая, форму держит НО...И об ьяснить то не могу( УВЫ)",1,0,0,0
"Класс,очень нежно и расход маленький",1,0,0,0
"Жаль, что на упаковке не написан ни каунт, ни размер отреза... когда заказываешь несколько разных - приходится сверяться с заказом по коду или самим определять... и лежало у меня перед глазами 4 одинаковых пакетика... и думала я, гадала, какой из них положено подружке передать...",1,0,0,0
"Пряжа мягкая, тактильно приятная, но ангора не равномерно положена на шёлк, при вязании очень видно, где густо, где пусто. За это сняла звезду. Большой расход, на 46 размер джемпер в длину ещё только 45 см, уже ушло 3 мотка. Посмотрим как будет выглядеть после стирки",1,0,0,0
Даже с небольшим опытом вышивания получилась прекрасная работа!,1,0,0,0
"Пришёл совершенно другой набор! Был куплен в подарок. Если такой отзыв пишет не первый покупатель, тогда, может, стоит задуматься Wildberries  над сервисом?",1,0,0,0
"ОТВРАТИТЕЛЬНО! неужели не видно ,что вместо 5 вы 1 положили?!",1,0,0,0
"Масло классное, очень хорошо помогает от мышечных болей после физических нагрузок , так же хорошо помогает при головных болях ( втираю в виски и заднюю поверхность шеи) . Может ощущаться лёгкое покалывание после нанесения и появляется белый налет при высыхании. Налет можно стряхнуть одним движением руки.",1,0,0,0
"Приятная в вязании пряжа, не сыпется, петли ложатся ровно. Вяжу в две нити спицами # 4.5 - мне кажется это идеальное соотношение. Как изделие поведёт себя после ВТО пока не знаю, постараюсь дополнить отзыв после ВТО",1,0,0,0
"Мне не понравилось, после нанесения неприятные ощущения в течение 5-10минут, как будто щипит, хотя на теле порезов и ран нет . Пользовалась в течение двух недель, ничего не изменилось, в итоге отдала масло))",1,0,0,0
Все отлично,1,0,0,0
Шикарная пряжа .,1,0,0,0
"Коврик отличный. Греет хорошо. Теперь моему цветочку тепло и уютно. Главное, чтобы прослужил долго",1,0,0,0
"Пряжа мягкая, приятно вязать, но только может я рыхло вяжу так, но устроило полотно только на спицах 3, на 4 рыхловато было, а производитель аж 5 рекомендует🤷🏼‍♀️",1,0,0,0
"Не заметили сразу, дома обнаружили что вместо 10, в упаковке 9 клубков... Обман!",1,0,0,0
"Очень красивая, приятная и качество 👍Связала подарок дедушке 🎁🧶🌸🎉",1,0,0,0
Вместо пряжи Drops Fabel белого цвета доставили пряжу Drops Alpaka бежевого цвета.,1,0,0,0
Оболденный кид-мохер на шёлке!  Италия конечно ни с чем не сравнима. На паутинку уходит 2.5 мотка,1,0,0,0
Классная работа получилась. Хороший бисер. Рекомендую.,1,0,0,0
выдали не весь заказ - пришлось возвращаться,1,0,0,0
Не хватает двух деталей. Вот таких закрепляющих барашков,1,0,0,0
Цвет не соответствует картинке.,1,0,0,0
"Всё замечательно, ещё не пробовала. Только зачем, Wildberries, клеить свою наклейку прямо на способ применения?",1,0,0,0
"Пряжа классная, мягкая, красивая. Но прислали 1 моток.",1,0,0,0
"Честно, пока не нашла для себя как его использовать. Мазала на кожу головы начался зуд, наносила на тело, остаётся липкая плёнка, не знаю что с ним делать",1,0,0,0
Качество ужас,1,0,0,0
"Не подошел цвет. Отказ, к сожалению",1,0,0,0
"Станок классный. Все обработано (без заусенцев). НО ЕСТЬ НЮАНСЫ: 
1. Я бы сделала инструкцию сборки основного станка пошаговой. У рамы такая есть. 
2. Обратите внимание на размеры болтов ( они разные). Мне пришлось перекручивать. 
3. Хорошо бы чтобы в перечне деталей основного станка была их картинка. 
4. Не ясно назначение деревянных дистанционных шайб. Если собирать по инструкции, то изделие перекашивается.
5. Ткань из зажимов ползет потихоньку. Приходится поправлять. 

Но в целом, впечатление позитивное. Хотелось бы лупу и подсветку к нему, а еще держатель для схемы.",1,0,0,0
"Отличное обслуживание,хороший набор",1,0,0,0
Вскрыт набор не хватает цветов ниток,1,0,0,0
"Прислали вместо зяблика от арабески, станок Серега мастер другой комплектации",1,0,0,0
Пряжа хорошая. Но цвет прислали другой. Пришлось оформить возврат. При новом заказе цена выросла на 600 рублей,1,0,0,0
"Классный мохер - мягкий, пушистый - очень хорошо подошёл для вязания маленьких вещей для маленьких куколок",1,0,0,0
"Отличная пряжа. На фото она светлее, чем в оригинале.",1,0,0,0
Пряжа шикарная,1,0,0,0
"Набор шикарный, с хорошей скидкой, полная комплектация.Спасибо продавцу!",1,0,0,0
Цвет на фотографии  отличается,1,0,0,0
"Вообще не понимаю, для чего оно... Никакого эффекта.... Зря потраченные деньги.",1,0,0,0
"Пряжа пришла быстро,но,видно что уже была использованна,где то испачкана,с потёртостями,и с выцветшими местами,безобразие,это я ещё не измерила сколько в мотке осталось метров,не хорошо впаривать б/у!",1,0,0,0
Спасибо за быструю доставку!,1,0,0,0
Цвет не соответствует описанию.,1,0,0,0
"Отличные нитки! Как и вся Пряжа этой фирмы)) не дёшево, но качество на 5! Советую к покупке.",1,0,0,0
"Очень ждала набор, но, к сожалению, вынуждена была отказаться, поступил вскрытый, в разодранной упаковке.",1,0,0,0
"Мне очень понравилась пряжа, брала для коврика.",1,0,0,0
Пришло быстро из упаковки не доставала ещё.,1,0,0,0
"Пришел спрей странный. Этикетка какая то мутная и не четко напечатано. Нет ни каких товарных знаков, штрихкодов, адрес производителя. Где и когда изготовлено. Печет сильно на коже, аж больно. На дне написано doplast.Производитель, это хороший товар? А деньги уплаченны.",1,0,0,0
Не настоящее!..... Подделка с распечатаной наклейкой.,1,0,0,0
Чвет белой-яичной скорлупы (не чистый белый),1,0,0,0
"Вышивка просто в удовольствие! Набор полностью укомплектован, бисер качественный и красивый, еще остался. Брала с хорошей скидкой! Благодарю производителя и магазин WB!",1,0,0,0
"Жаль, что нельзя поставить 0! Пришёл обычный отрез ткани.",1,0,0,0
Согласна с предыдущим автором: цвет совсем не тот.,1,0,0,0
"На фото образец, связанный на двушке. Цвета 15 и 04. Брала за 931 руб комплект. Это адекватная цена, соответствующая другим площадкам.",1,0,0,0
"Пряжа шикарная, но вот цвета вообще не попадают к сожалению. Пришлось делать возврат. На фото цвет в реальности и на сайте, номер 05.",1,0,0,0
"Ужасный покрой, красная цена 500 руб",1,0,0,0
Отличная пряжа,1,0,0,0
Набор пришел хорошо запакованным. И по супер цене!,1,0,0,0
"Упакована вышивка отлично! Конва качественная, бисер на 5 и 3 иглы в наличии! Но сама техника сложна обратите внимание- нет дырочек в Канаде, каждая бисеринка в своём отдельном направлении.",1,0,0,0
"Ужасный склад Казань ((((
Прислали непонятно, что, но только не мой заказ 
В сам магазин WB не позвонить, хоть и есть телефон((( не соединяют с оператором. Если можно было бы поставить 0 звезд,то я бы это сделала 

К качеству товара, претензий нет, тк нет товара",1,0,0,0
"Отвратительно. Жду уже больше недели, все время статус задерживается. Заказывала розовую и голубую. Голубая пришла очень быстро, а розовая непонятно где.",1,0,0,0
"Отличная пряжа, вязать одно удовольствие",1,0,0,0
"Пришли не те, очень жаль. Перезаказала",1,0,0,0
Весь пролитый. Когда вы научитесь упаковывать товар??????,1,0,0,0
Заказала серую пряжу. Пришла розовая. Отказ.,1,0,0,0
"Тёплая, мягкая пряжа, не растягивается в процессе носки. Связала кардиган и платье в одну нить.",1,0,0,0
"Заказывала 8 моточков на жакет, везли по 2 моточка.... из Казани, Москвы... но, бывают же чудеса, номер партии одинаковый!",1,0,0,0
"Отличный набор , картина получилась яркая , хороший бисер, спасибо производителю",1,0,0,0
"Отличная пряжа. На свитер женский 48 размер брала 6 мотков, вязала спицами 2.5 в одну нитку Лицевой гладью. Получилось отлично. Очень тёплый, тело дышит. Ношу с удовольствием. Спасибо. Цвет не светло-коричневый, а горчичный. Ооочень красивый.",1,0,0,0
Возврат . Прислали вместо белого цвета - зелёный.,1,0,0,0
"Набор мечта, был подарком от близких на День Рождения, но уважаемый продавец, совесть то надо иметь, недешевый набор приходит в таком виде, вскрытый, потасканный, пакет сверху одеть , это что , роскошь? Стояла в пункте выдачи, и не знала , что делать... Вроде все на месте,  но настроение испорченно.",1,0,0,0
"К сожалению, нить оказалась тоньше, чем я ожидала. 
Впервые столкнулась с длительным возвратом денежных средств 18.04 отказалась от пряжи, на сегодняшний день 26.04 даже оповещения о возврате денег не получила, обидно...",1,0,0,0
"Отлично работают, реально действует для рассады. Ещё в апреле перенесли рассаду в парник с этими ковриками - ничего не смёрзло. Заказываю уже четвёртый :)",1,0,0,0
"Прислали не тот набор, возврат !(((",1,0,0,0
Не понравилось совсем. Бисер плохого качества. Сама схема требует доработки......,1,0,0,0
"Заказывала маме, ей все понравилось! Она чаще Demensions покупает, поэтому я переживала, что схема со значками черно-белая, но ее хорошо видно на самом деле и не так сложно. Вышивается легко все двойным крестиком. Цвета у ниток очень понравились, ни одного слишком яркого или кислотного цвета, даже красный приятный и не раздражает. У нас все было запечатано.",1,0,0,0
"Он просто суперский! Весь такой гладенький, красивенький! Очень классный! Массаж им делаю без крема ,скользит отлично!  А если еще в холодильнике подержать, то супер с утра! Никаких сколов  или царапин нет. Он идеален! И функционален и красив! Спасибо",1,0,0,0
"Пряжа просто супер! Свитер легкий и нежный, тёплый, как облачко, снимать не хочется. Это была моя первая связанная своими руками вещь. Нитка очень лояльна к косякам, пропущенным петлям и т д))) все скрывает.",1,0,0,0
"Отличное поло , подошло идеально ,ткань приятная к телу , взяли по таблице размеров , на 58-60 р-р , на рост 176 смотрится 👍, были бы ,ещё другие цвета , этого размера , купили непременно .",1,0,0,0
"в целом, отличные пяльца. снимаю звезду по двум причинам. во-первых, инструкция это просто жуть. понятно, что ничего не понятно. приходится включить смекалку. мой вам совет, попробуйте собирать начиная с самой рамы для вышивки. во-вторых, нет креплений для полотна, так что заказывая это чудо, не забудьте и крепление.",1,0,0,0
Что за дерьмо? Украли моток... пакет разорван,1,0,0,0
