"Купила нитки. Цвет коралловый. Сразу четыре мотка. И вроде бы все отлично. Но! Взяла два мотка и стала вязать в две нитки.... В результате на данный момент в одном осталось 10 грамм, а другом 35. Как такое может быть? Они должны закончиться одновременно. Даже и не думала раньше, что нужно взвешивать мотки ( по другому и не оценить, может уже кто-то отматал чуть чуть ;(. )",1,0,0,0
"Держит форму хорошо, приспособила под канву 100х150.",1,0,0,0
"Пряжа мягкая, пушистая, вяжется легко. Изделие получается приятным к телу, не колется. Пришли все 3 штуки.",1,0,0,0
👍👍👍👍👍👍👍👍👍👍👍,1,0,0,0
"Хорошая пряжа, толстенькая, греет хорошо, ровно быстро вяжется, но дороговато даже со скидкой. Взяла только что цвет понравился и производитель заинтересовал, а так наша Пехорка не хуже и дешевле намного.",1,0,0,0
Упаковка качественная. Красивая нить.  Вязать одно удовольствие.,1,0,0,0
"Честно говоря, не понравилась пряжа. Она, конечно, мягкая, приятная наощупь, но, во-первых, цвет не соответсвует фото (в реальности цвет более насыщенный, не такой приглушённый), во-вторых, цвет не однотонный а с розовыми вкраплениями, и в-третьих , мне не понравилось как пряжа при вязании расслаивается. И моточки очень маленькие. Считаю, цена завышена.",1,0,0,0
"Получила иконку,упаковано хорошо👍..не поняла,почему в комплекте нет ниток.🤔..возможно, конечно,это упущение производителя,но вы тогда хотя бы пишите,что к этому набору нитки надо приобретать отдельно....и было бы совсем идеально,если б писали количество цветов бисера...
Скоро приступаю к отшиву, возможно отзыв будет дополнен фото уже готовой работы😜",1,0,0,0
Только начала вязать. Пока всё хорошо без узлов. Вообще люблю эту пряжу,1,0,0,0
Очень сильно лезет,1,0,0,0
"Доставка быстрая, упаковка не повреждена, комплектация целая. Шлифовка деталей порадовала. Сборка лёгкая. Очень удобный станок.",1,0,0,0
"Красивый, качественный набор! Уже четвёртый в моей коллекции от этого бренда. Канва нежно-бежевая, 16. Схема черно-белая, значки средние, хотелось бы покрупней!",1,0,0,0
"Очень понравилась токтильно и цвет яркий. Шапка связана полностью из Каризма в белом цвете и фуксия. Спицы 3,5. Немного колется по моим ощущениям, но ребенок не жалуется на дискомфорт. Расход на шапку с окружностью головы - 51см: 1моток белого и 1 моток фуксия.",1,0,0,0
Пришел другой набор. Возврат. Придется заказывать снова. Прошу не снимать процент.,1,0,0,0
Соответствует описанию. Ниточка хорошо скользит по спицам. Ложиться отлично.,1,0,0,0
"Пряжа классная! Цвет супер, на ощупь мягкая! Очень довольна! Упаковка целая!",1,0,0,0
"Добрый день . Получила набор уже на второй день  . Все хорошо упаковано. Но у меня вопрос : чем отличаются вот эти два набора? Я выложу фотку . По цене они очень разные но вроде по описанию все одинаково , а цена такая разная ! Техника одинакова . В чем разница ?",1,0,0,0
"Какая прекрасная брошь 😍 вообще качественный набор фирмы «Образа в каменьях»,есть с чем сравнивать.Теперь на очереди этого же производителя брошь  «Матрешка» 🥰",1,0,0,0
"Интересная пряжа. Связала пледик для малыша. Но под ним тело потеет🙁 хотя у пледика связанного из alize puffy такого не наблюдается. А ещё запах, после нескольких стирок не ушел, может кому то понравится, но для грудничка я бы не рекомендовала!",1,0,0,0
"Цвет ближе к светло сиреневому. Пряжа хорошая, вязать одно удовольствие.",1,0,0,0
"Пришла не та икона. Заказывали святую Татьяну, в итоге получили Маргариту",1,0,0,0
Неприятный запах держался несколько дней.  Горячего не боится.  Я брала на скатерть.,1,0,0,0
"Товар пришёл без колпачка, но пользуюсь уже 2 недели и качество мне нравится!",1,0,0,0
"Первые впечатления были двоякие. Красивый цвет, запаха нет от пряжи, но толщина нити явно меньше заявленной. Ализе взяла впервые, сравниваю с Пехоркой. Вязала шапку с отворотом и снуд в 2 нити, варежки в одну (комплект на ребенка 3года) и еще полтора мотка пряжи осталось. Вязать очень легко и приятно. И еще по моим ощущениям что щерсти тоже меньше, чем указано, похоже как на 30шерсти и 70 акрила. Ну так как шапка в 2 нити и отворот, думаю зимой будет нормально.",1,0,0,0
"Полное несоответствие цвета, представленного на фото. Магазин вводит в заблуждение покупателя, так как под  фото есть описание по номеру артикула 2917 ""бирюзовый"". В действительности неяркий грязно-голубой оттенок. 
Только за это ставлю 1 звезду.
Огромная просьба  к магазину - выкладывать на сайте реальные фото товара!",1,0,0,0
Вчера решила смотать два моточка в один! Оказалось что в одном лотке длина нити больше чем в другом!  На фото остаток нити.,1,0,0,0
очень маломерка качество нормальное но рисунок напоминает робу особого режима,1,0,0,0
"Я фанат этой пряжи! Она шикарна! Мягонькая,невесомая и пушистая!",1,0,0,0
"Цвет абсолютно не соответствует фотографии,на самом деле тусклый, невзрачный,весьма отдаленно напоминающий сливу. Планировала связать дочери комплект, шарф и манишку,но она отказалась,хотя специально выбирали самую неколючую .Пряжа тонкая,для шапки надо соединять в 4-5-6 нитей. ,Забрала,свяжу себе кофточку,есть с чем скомбинировать. Жаль,что так получилось, больше не буду заказывать пряжу по интернету.",1,0,0,0
"К сожалению нет возможности оценить товар, поскольку прислали пряжу другого цвета.
Досадно, я расстроилась",1,0,0,0
"Твари, этот моток розовый всем суют, деньгами пользуются..., другими лова и это и не назовёшь",1,0,0,0
Цена на других сайтах 425- 450 рублей!!!,1,0,0,0
"Товар пришел без упаковки и колпачка. За это снимаю балл.

Само масло отличное. После долгого сидения за рабочим столом можно смазать затекшие плечи, плечи моментально расслабляются. Если болит голова - немного масла на виски и всё проходит. При синдроме беспокойных ног смазываю стопы на ночь. 

Распылителем удобно пользоваться. Можно прыснуть на руки, можно сразу на тело. Неприятного запаха нет.

Осторожно - в силу состава масло может оставить на темной одежде следы.",1,0,0,0
Очень тонкая.,1,0,0,0
"Мягкая приятная пряжа, невозможно выпустить из рук вязание. Связала то ли пледик, то ли шарфик👍😀размер изделия из четырех мотков 65*120, в ряду 50 петель. Петля 2 см высотой, узор крестом не свяжете, нужна пряжа с петлями 4 см.",1,0,0,0
"Отличная рама. Все пришло в нужном размере и в полной комплектации. Несколько лет пользуюсь станком Иволга от Арабеска к нему брала рамы различного размера и не по одной штуке. Ни разу у меня ни к одной раме не возникло нареканий по качеству. Рамы меня полностью устраивают. Для своей стоимости отличные рамы! Рада, что Арабеска появилась на WB! Ранее приходилось покупать дороже и с доставкой. На раму 40х56 комфортно помещается стандартный отрез основы 50Х70 (см фото) и стандартный отрез Dimensions Gold. На высоту 40 руку тянуть конечно не удобно, но я вышивая верхнюю часть работы опускаю планочку ниже на пару делений, а потом поднимаю на верх и остается большое пространство для бумажной схемы или планшета, для магнитика с иглами и просто приятно рассматривать уже отшитый участок работы. Для хорошей ""барабанной"" натяжки основы раму надо подбирать чуть большего размера. Поэтому данный размер рамы обязательно необходим вышивальщице, которая вышивает не только маленькие работы.",1,0,0,0
Отличнся пряжа,1,0,0,0
"Решила вышивать с центра, как всегда крестиком, потому что боюсь ошибиться с разметкой. Остаётся только ждать. Почти закончила один лист из 8 за 2 недели. Позже дополню)",1,0,0,0
"Пришёл без крышки колпачка!!!! Как такое дарить???? А может там и вовсе не масло, а не пойми что!",1,0,0,0
"По ощущениям нитка неприятная , ощущается полная синтетика.",1,0,0,0
"Замечательная пряжа, ровная .без разрывов. Немного жестковата, но мне именно такая и нужна была. Вяжу на 2.5 спицами, очень ровно. Как поведет себя изделие после стирки- посмотрим. Единственное- цвет немного подкачал. Он просто розовый. Там серости нет и в помине. А я хотела пепельную розу. Но, впрочем, сам по себе цвет все равно красивый.",1,0,0,0
"Вязать одно удовольствие! На свитер размера М ушло 4 мотка. Пряжа мягкая, шелковистая, пушистая. После стирки слегка растягивается в ширину, резинку держит слабо. Вязать лучше гладью.",1,0,0,0
"Пришли нитки нужного цвета, ещё не вязала. Предварительно колючая немного, думаю на шапку не пойдёт, буду вязать детскую жилетку, чтоб не на голое тело...",1,0,0,0
"Как и писали в отзывах нет номера 17, ниток много, но хотелось бы чтобы нитки были закреплены лучше, для того чтобы не путались. Снижаю из-за отсутствия ниток одну звезду",1,0,0,0
Для вязания спицами отвратительная пряжа. Лицевой гладью невозможно вязать. Полотно косое.,1,0,0,0
"Упаковка пришла вскрытой, одного мотка не хватает. Забирал муж из пункта выдачи, не знал,  что должно быть три мотка. В пункте отказали в возврате, их можно понять, вдруг мы этот моток сами вытащили.Но это уже ни в какие ворота не лезит, как можно так собирать товар, либо его в дороге вскрыли? Почему покупатели должны страдать. Оформила заявку в личном кабинете на возврат, если и там откажут, больше никаких дел с этим магазином иметь не буду!",1,0,0,0
"Мягкая, приятная, но цвет не тот совсем, ближе к горчичному. Далеко до невинного жёлтого...",1,0,0,0
В восторге от пряжи.цает очень красивый,1,0,0,0
"Пряжа хорошая с блеском идеально для крючка.
Образец связан в две нити.",1,0,0,0
Удобный станок,1,0,0,0
"Отличная пряжа, на взрослую шапку с глубоким отворотом резинкой 1*1 ушло почти 2 мотка. Во время вязания ниточка показалась грубоватой и колючей, но после стирки (в стиральной машине) стала мягкой и более объемной с небольшим пушком, петельки расправились. Покупкой однозначно довольна.",1,0,0,0
"Этот цвет не желтый, как на картинке, а вот прямо чисто горчичный. Но все равно забрала. Оооочень мяконькая! Оооочень душевненькая! Хочется укутаться в такой шарфик или в варежечки такие)",1,0,0,0
"Набор понравился, пока не вышивала. Все необходимое в комплекте имеется. Судя по предыдущим отзывам и фотографиям, должно получится красиво.",1,0,0,0
"Смотрю по фото в отзывах, что приходят разные — разного цвета мешочки, с гравировкой и без... Мне пришел в черном мешочке, без гравировки. Минус — цена объективно высокая, конечно. Но плюс в том, что его невозможно разбить, уронив, поэтому в итоге выйдет дешевле, чем штуки три разбитых каменных. У меня дома дети — без вариантов рано или поздно разобьют. Отсюда же плюс — удобно брать с собой в дорогу и носить в косметичке, легко почистить. Сильно отражает, я иногда использую как зеркальце для нехитрых операций типа нанести бальзам на губы. Со временем понемногу царапается. Выполнен качественно, правда на одном ребре есть маленький стык отлива, но он не мешает. Пользуюсь, в целом довольна.",1,0,0,0
"Все 
Ок 
Отлично",1,0,0,0
"Очень красивая! Всё в наличии, бисер качественный. Нестандартный размер, рамку придётся заказывать.",1,0,0,0
"Действительно, 7и 9 на ткани выглядят одинаково.просмотрела и пришлось полряда перешивать. Хорошо, что хоть не позже.Случайно на схему на бумаге взглянула. И рамку можно было более контрастно сделать на ткани, а то все глаза сломала.Где-то цвета вообще не совпадают- жёлтый матовый на схеме оранжевый, а на рамке еле различимы серый и золотой.Вышиваю вторую икону этой фирмы.С первой вообще проблем не было. А эта красивая сама по себе, а вот цветовая схема неудачная",1,0,0,0
"Быстрая доставка. Заказывала 2 упаковки. Упаковано в пакеты, без повреждений. Вся пряжа одной партии(очень приятно), т.к планируется джемпер. Очень приятная и мягкая пряжа. Данную пряжу будут пробовать впервые.камера искажает цвет.",1,0,0,0
Цвет огонь .,1,0,0,0
"Использовали только 1.5 мотка, петельки все на месте были",1,0,0,0
"Пряжа пришла быстро, все клубочки на месте. Спасибо.",1,0,0,0
"Отличная нитка, куплю еще",1,0,0,0
"Цвет не соответствует тому, что на фото",1,0,0,0
"Ну очень тонкая пряжа. Даже в две нити. И цвет больше кремовый, а не белый.",1,0,0,0
"Коралловый очень красивый, слегка приглушенный, не ядовитый, вяжу в 1 нитку спицами №2 полупатентной резинкой, полотно получается ровное, пластичное. Из этой пряжи вяжу третье изделие и ещё планирую из неё вязать.",1,0,0,0
"Вот скажите, это под каким освещением так нужно фотографировать товар, чтоб цвет настолько отличался? Согласитесь, это совершенно другой цвет. Номер расцветки совпадает. Нитки то хорошие, но цвет мне не подходит.",1,0,0,0
"Пряжа шелковистая, тонкая, но колется. Без майки трудно носить. На голое тело некомфортно. Но очень тепло. Ушло чуть больше 8 мотков, свитер 50 размер оверсайз в одну нитку, резинка в две.",1,0,0,0
"Хорошие банки! Купил для дочки, для слаймов, теперь есть где хранить)",1,0,0,0
Жена очень довольна!,1,0,0,0
"Упакована была хорошо в плёнку и пакет, но при вскрытии сама пачка оказалась с порезом. Я вскрывала руками, порез уже был еще до отправки видимо. Пришлось заклеивать, чтобы соль не высыпалась. Ещё не пользовалась.",1,0,0,0
"Пряжа просто супер,заказывала бордовый цвет очень яркий,изделие получается очень мягкое не колючее.Супер...",1,0,0,0
"Снимаю звезду за не соответствие цвета на фото. В реальности цвет совершенно другой, темный ... упаковку даже не открывала,не взяла , потому за качество ничего не могу сказать .",1,0,0,0
Хорошие бабушка в восторге,1,0,0,0
"получила заказ в поврежденной упаковке . Не известно , на каком этапе она была повреждена , в итоге не хватает одного пакета с бисером .Очень огорчена , т.к.стоит не дешево , оплата была онлайн . Заявку отклонили . Набор за счет большого количества бисера тяжелый , дополнительно хотя бы упаковывали на фирме , мог элементарно прорваться при доставке . С кого теперь спрашивать ?",1,0,0,0
"Набор пришёл вскрытый. Не стала ничего проверять. Теперь вынуждена ждать возврата средств на карту до 5 рабочих дней и снова заказывать по более высокой цене. Плохо знакомство началось с Вашей фирмой, однако. Эх, а было столько планов..",1,0,0,0
"Отличные Банки , рекомендую , ребенок делает слаймы постоянно , очень понравились , все упаковано , соответствует заявленному , обязательно закажу другого размера , этого производителя .",1,0,0,0
"Пряжа изумительная.  Дочь заказала очень дырявую паутинку. Утверждает, что это сейчас в тренде. Вязать буду спицами #10!!!!  Образец отвязала, понравилось.",1,0,0,0
"Бисер , канва хорошего качества ! Рекомендую!",1,0,0,0
Супер. 10 из 10. На 2 шарфика и 2 шапки ушли 4 мотка ровно.,1,0,0,0
"Пряжа замечательная, связала из двух моточков обьемный шарф, он не колючий, легкий, эластичный, красиво драпируется и не вытягивается.",1,0,0,0
"Не думала что такое есть. На работе холодно. А теперь ножки не мерзнут. Очень удобно. Я врач,сижу на приеме с ковриком и ничего не видно.",1,0,0,0
"К сожалению, не угадала с цветом, оказался темнее, чем мне нужно, а так пряжа отличная, брала пудровый цвет.",1,0,0,0
"Пряжа очень понравилась. Тоненькая, мягкая. Посмотрим как будет в изделии. Брала для носочков.",1,0,0,0
