"Молочная пряжа, совсем даже не молочная, а скорее свело серая, не самого чистого оттенка 😒. А в остальном пряжа хорошая.",1,0,0,0
Очень хороший массажёр! Качество супер. Пришёл без повреждений! Спасибо,1,0,0,0
"Получила набор, все сделано хорошо. Но почему инструкция на английском? Это же наборы не для английских рукодельниц?! 🤔",1,0,0,0
"Пряжа мягкая, цвет соответствует. Хватило на комплект (без остатков). Шапка на спицах номер 2 (120 петель), снуд на 3 (96 петель). Нитка состоит из 6 ниточек. После стирки размер увеличился на пару см.",1,0,0,0
"Товар, может,и отличный,но мне положили не тот набор!не под тем номером вышивка. Ошибка склада. Перезаказала",1,0,0,0
"Пряжа пришла упакованная в пакет, компл 3 шт. Визуально хорошая.",1,0,0,0
Соответствует,1,0,0,0
"Пришёл чучуть вытекшим! Но не кречично. Ни чем ни пахнет,но масляный. Папользуюсь дополню",1,0,0,0
"БРЮКИ ДЛЯ МОЛОДЕЖИ, МАТЕРИАЛ ПРИЯТНЫЙ,ШЕЛКОВИСТЫЙ, СТРЕЙЧ,ДЛЯ ЛЕТА. НА МОДЕЛИ БОЛЕЕ СВОБОДНЫ СИДЯТ.",1,0,0,0
Вы че прикалываетесь? Цвет вообще не соответствует заявленному бледно-голубому. Пришел какой то серо буро козявчатый,1,0,0,0
"Брала эту пряжу в других оттенках на раз... почувствовала разницу , особенно- она линяет.  Это впервые, хотя я работала с яркими оттенками,  малиновый и зелёный этой же серии,  ничего никогда не линяло ...а эта прям очень сильно,  ладно бы слегка...",1,0,0,0
"Вязать не очень комфортно, НО! Изделие получается мягкое, шелковистое, просто прелесть! Цвет чудесный! Жаль , что нельзя докупить один моток, а только три, не хватило совсем немного. Вяжу детскую безрукавку в две нити. Для детских вещей- просто находка.  Так что куплю три мотка и останется на шарф внучке. Спасибо!",1,0,0,0
Очень хорошие пяльцы,1,0,0,0
"Заказываю часто и много. Но сегодня, получая заказ очень удивилась.Мне отдали пакет с пряжей, а она рассыпалась по полу, хорошо не в лужу грязи. Почему такая крупная фирма как Валдберис позволяет себе доставлять товар покупателю в некачественной упаковке? Пакет с пряжей был разрезан с двух сторон. Пряжа хорошая, а отношение к покупателю- не очень...",1,0,0,0
"Хороший набор, бисер калиброванный, яркие цвета",1,0,0,0
"Очень приятно вязать этой ниточкой, изделие получается нежное, мягкое и совершенно не колючее, как и положено мериносу. Цвета действительно совершенно не соответствуют реальным. Если хочешь узнать какой на самом деле цвет номер 19, смотри фото номера 39 и наоборот: 39-му номеру подойдёт фото от 19-го. При работе с этой чудесной пряжей надо учитывать, что после ВТО будет прибавка на 1, а то и 2 размера.",1,0,0,0
"Пришло все целое, хорошо упаковано. От головной боли к сожалению мне не помогает это средство",1,0,0,0
"Хорошая качественная мягкая пряжа, тепленькая, но маловастенькая, на хорошую шапку английской вязкой с отворотом диаметром 58 см и в длину 36 см нужно как минимум 5 мотков, поэтому ещё дозаказала",1,0,0,0
"Дважды заказывала пряжу фуксия, малиновый, вишневый № 13, но на складе упорно отправляют пряжу № 40 сиреневого цвета. Прошу не снимать мой процент выкупа.",1,0,0,0
Красивая ровная вязка. Ощучения в изделии самые приятные))) вязала шапочку,1,0,0,0
"Заказывала иволгу, пришёл снегирь, да ещё и меньшего размера. Возврат. Очень обидно, ждала станок 2 недели",1,0,0,0
"Решила написать, так как мало отзывов) Вязала палантин, метр на два, на третьих спицах. Ушло 15 моточков. Пряжа не лёгкая для вязания, ниточки цепляются, распускать практически не возможно, та что берите пряжу с учётом вывязывания образцов. Получилась очень тёплая, мягкая, совсем не колючяя. Стирала шампунем в прохладной воде дважды, так как линяет. После высыхания не села и не растянулась. Чуть расчесала счеточкой ворс для эксперимента, особой разницы нет, если только по краям. Для шапок и плечевых не подходит вообще, резинку не держит. Всем прекрасных изделий!!!",1,0,0,0
"Пряжа приятная,НО вот узлы в ней вообще меня не устраивают!Тем более цена у нее не 70 руб.за моток!!!
За это только 3 звёзды!",1,0,0,0
"Заказывала темно-синий, пришёл джинсовый! Конечно пряжа все равно пригодиться, но вы мне сорвали мои сроки выполнения заказа!!!!",1,0,0,0
"В камплекте нет нитки специальной, нет иголок, картина ужасная мне не нравится",1,0,0,0
"Пряжа просто класс, но цену надо снизить, в вязке смотрятся красиво и вязать только а радость ими.",1,0,0,0
"Масло брала для укрепления волос, после 3-его использования увидела отличный результат, волосы стали выпадать в 3 раза меньше! Однозначно рекомендую данный товар. Наношу на корни волос, пару минут втираю, далее целлофановый пакет и укутываю полотенцем и оставляю на 30-40 мин.",1,0,0,0
"Привезли Nord вместо Merino. Сразу не проверила, теперь «большой сюрприз». Звезда для для WB. К товару претензия лишь одна - не тот(",1,0,0,0
Как я мечтала о ней.Великолепная пряжа.,1,0,0,0
"Малыши, очень маленькие клубки",1,0,0,0
"Многострадальная, трудненькая для меня оказалась работа. С перерывами почти 5 месяцев. Но такая замечательная и одна из самых любимых. А после оформления в прекрасный багет трудно оторвать взгляд. В подарок близкому мне человеку ничего не жалко. Пусть радует не только меня, но и других людей. Спасибо производителю за это чудо и WB за скидку.",1,0,0,0
"Возврат, так как вместо 4 пришло 2 мотка. Придётся одну пачку перезаказывать. Сама пряжа нравиться, пока все что заказывала было удачное, петли ровные. Так что снизела звезду магазину.",1,0,0,0
"Хорошая пряжа, и со льном надо уметь опыт управляться. Пряжа для вязания крючком, не для спиц! Шикарные летне-осенние шали!",1,0,0,0
"Мне не понравилось... Испортила новый компьютерный стол вздулся, зачем вы пишите в инструкции что надо мочить стол чтоб прилипло.. Нельзя сделать на клеевой основе одну сторону.. Вообщем хотела ребенку закрыть стол чтоб он его не испортил когда делает поделки... В итоге самая его испортила.. Повелась на отзывы...",1,0,0,0
"Покупал маме, очень довольна.",1,0,0,0
"Хорошо упакован, попробую напишу в действии...",1,0,0,0
"Почитала отзыв девушки про  набор Физалис, что схема цветная и купила этот набор. На самом деле схема чёрно-белая символьная (крупная, на несколькольких листах) поверх которой нанесен цветной бэк!!!!! Это кошмар!!! Очень разочарованна!!!! Можно схему было сделать чуть меньше и отдельно схему на бэк!!!!!!",1,0,0,0
"Огромное спасибо производителю за эту пряжу, да и вообще, качество Пехорки всегда хорошее! Конечно, вязать в одну нить у меня терпения не хватило) но, связав в 2 нити спицами N2,75 племяшке кофту, получила огромное удовольствие от вязания. И, это несмотря на то, что до этого спицы меньше N4 в руки не брала) Пряжа нежная, без узелков и прочего. С изнаночной стороны переходы более расплывчатые.  На кофту худенькой девочке 1,5 лет ушло чуть меньше 3 моточков. Пряжу брала за 735 руб (6 шт). Считаю, это не дорого для настоящей шерсти, в любом случае, вы получаете теплую уникальную вещь, сделанную своими руками, а не китайский ширпотреб, которым сейчас завален рынок. Наберусь терпения и обязательно свяжу себе свитерок в одну ниточку) жаль цена на площадке меняется часто и не в меньшую сторону. буду ждать хороших скидок!)",1,0,0,0
"Очень довольна результатом по этому набору! Вышивается легко и быстро, правда, есть и замечания. Схема обалденная, значки четкие, ткань плотная, правда, ощущение, что бисер второго сорта, в процессе вышивки пришлось калибровать. Но учитывая цену набора и огромный запас бисера (после отшива его осталось очень много), все просто отлично! Спасибо за такой набор! Давно хотела вышить маки и именно такиие в моем доме появились первыми 😍",1,0,0,0
"Набор пришёл целый, схемы понятные, нитки очень красивые, две иголки, всё супер",1,0,0,0
"Заказала нитки, а пришёл календарь! Первый раз такое!",1,0,0,0
"Прислали 1 моток, вместо 3-х. Возврат",1,0,0,0
"Пришел в мешочке. Красивый, серебристый, но... Очень тонкий, не рискну таким массаж лица делать, и не кажется травмы не избежны
Отказ.",1,0,0,0
"Пряжа замечательная, но цвет мрачноват оказался. Скорее серый.",1,0,0,0
"Прекрасная пряжа, очень ее люблю. Цвет немного ярче, чем на фото. Но мне в самый раз для детских игрушек и вещей.",1,0,0,0
"4 мотка яркой нитки, цвет, как на заставке сайта! Мне нравится!",1,0,0,0
"Очень дорого, масло там я не прочувствовала. Что там, только производителю известно, что-то очень соленое. Больше брать не буду.",1,0,0,0
Ну и.забрала набор и не посмотрела..а дома смотрю.а рисунка на канве НЕТ.и что. вышивать счетным крестом..которым я терпеть не могу.отстой..,1,0,0,0
"Пришло в стрейч плёнке хорошо замотано.Все целое, колпачке на месте по размеру на этот флакон.Будем пробовать в деле.",1,0,0,0
"Набором довольна, пришёл не вскрытый. Единственное не нравится что схемы не цветная, а сделана символами.",1,0,0,0
Отличное средство! Советую,1,0,0,0
всё понравилось 👍🏻,1,0,0,0
"Всё пришло хорошо упакованно, без нюансов, буду пробовать. Спасибо 🌷",1,0,0,0
"Набор прекрасный, в комплекте все камушки и бисеры соответсвуют, плюс есть ниткам иголка, приятный такой бонус🥰не так давно из этой серии вышивала икону Казанской Богородицы..(фотки прилагаю), хотелось бы ещё заказать икону Господа Вседержителя..🤗",1,0,0,0
Замечательная основа для вышивки по вкусной цене! Удобно для полукрестиков и четвертинок.,1,0,0,0
"Пряжа неплохая, ровная без узелков и неровностей. Однако очень колючая и рыхлая. ",1,0,0,0
"Коврик греет, ногам тепло!",1,0,0,0
"Вместо пряжи пришла футболка и перезаказать нет возможности,их нет в наличии,обидно.",1,0,0,0
"Ниточки хороши,но только до ВТО☝🏼.Очень сильно растягивается вещь ,это очень огорчило((А так вяжется легко и петельки все ровные.",1,0,0,0
"Не очень понравился. Нагревается проволока,  впечатанная в пластик. Когда дотрагиваешся - обжигает.",1,0,0,0
На любителя.,1,0,0,0
"Брал на дачу под ноги (пол только через сутки прогревается) для этого коврик просто супер за его цену (700р)
Так же можно сушить обувь.
А вот для животных, детей есть сомнения - мощность только одна и она максимальная, если ноги можно переставить, то постоянно лежат ьи ли сидеть на коврике некомфортно.",1,0,0,0
"Темно-голубой цвет такой как на моем фото (темнее чем представлено, но мне нравится). Мотки меньшего размера чем я ожидала- меньше ладони.",1,0,0,0
"Спицы нормальные, но очень хлюпкие. И одна леска или спица прокручивает , видно резьба плохо сделана. За такую цену я бы не взяла .",1,0,0,0
Все отлично,1,0,0,0
прислали не тот цвет,1,0,0,0
"Очень хорошая пряжа. Нить ровная, не такая уж и тонкая. Для спиц № 1,5 - 2 отлично. Можно и на № 2,5.",1,0,0,0
"В описании совсем мало синтетики, как говорится чуть-чуть. Для прочности. Но по факту мне привезли нитки с содержанием шерсти 9%! Это просто обман. За такую сумму и один сплошной полиамид! Хочу вернуть это безобразие и получиться деньги.",1,0,0,0
"Клеёнка хорошая, лежит на столе замечательно, минус то что остаются следы от бокала, но это не критично",1,0,0,0
"ЭТО ПОДДЕЛКА!!!! Не видитесь, это не оригинальный Дропс! Заказала 2 упаковки т.к. моей пряжи не хватило.  Свою я покупала в городе. Разница очевидна. Моя яркая, мягкая и объёмная, приятно пахнет шерстью. То, что я получила полный отстой....воняет китайской барахолкой, цвет тусклый, нитка тонкая и вовсе не пушистая как оригинальная пряжа, этикетка даже не закреплена в мотке. Кто вязал из настоящего Дрос Эйр сразу увидит разницу.....просто деньги на ветер!!!!! Это просто разочарование...я так надеялась",1,0,0,0
"Приятная пряжа, но учтите, что подобный формат не держит резинку и ее можно использовать только как узор! Взяла на замену дропс эйр, т.к. метраж аналогичный",1,0,0,0
"Пряжа очень мягкая и в то же время упругая🤗 Я брала её до носков, нопоняла, что, если вязать в одну нитку, то слишком тонко, а, если в две, то не выгодно🤔Поэтому добавила ангору, и в итоге  получилось то, сто надо! 👍",1,0,0,0
"Прошла неделя, пока греет, серая сторона греется сильнее, очень тепло, хорошо. Спасибо",1,0,0,0
"Из этой пряжи вязала впервые-понравилось. Получилась такая жилетка оверсайс, спицы 5,0,ушло 3 мотка.",1,0,0,0
"Немного досадно, что внутренняя упаковка оказалась разрезанная.
Видимо вынимали моток и обратно положили.
Потом упаковали в тонкий полиэтиленовый пакетик. 
Покупаю пряжу Пехорки уже не первый раз. Всегда привозили аккуратно запакованные мотки.
И цвет пряжи более тёмный, чем на фото. Не критично, но всё таки осадочек остался. Жаль.
Фото у меня не получается загрузить, я не мастер в интернете.",1,0,0,0
Своеобразный вкус. На любителя.,1,0,0,0
"Пришло вместо 4 мотков 3, более того внутренний пакет был разрезан, потому что пакет был запечатан. Отказ",1,0,0,0
"Судя по цене они из ""золотого"" дерева.",1,0,0,0
"""Детский каприз"" отличная ниточка, но к сожалению прислали совсем другую пряжу. Не ""детский каприз"", и цвет другой. Пришлось отказаться.",1,0,0,0
Пришло в целости и сохранности,1,0,0,0
Станок отличный. Я очень довольна. И как я раньше без него вышивала? 😊 Берите не сомневайтесь. Можно подогнать под вышивку любого размера. Спасибо производителю.,1,0,0,0
"Икона очень красивая!!! Но в схеме на ткани,цвета 7 и 9 не различимы совсем.
Вышивать нужно очень внимательно.
Я вышила много икон и такую схему вижу впервые.",1,0,0,0
"Пряжа отличная, но вот обслуживание специалиста ужасное в филиале г. Бишкек, 4 мкр. Пакет в котором лежала пряжа была порвана, я попросила дать целый пакет. На что он сообщил, что у них нет и я должна купить в другом месте.",1,0,0,0
"купила  на пробу  2  мотка, мне  понравились  эти  ниточки,рекомендую",1,0,0,0
"Греет еле-еле, какое там 40 градусов!!! И до этого еле-еле нагревается не за 5 мин, а за час. Полная фигня. Понятно, почему товар невозвратный,  и почему это сообщение появляется только после оплаты. Иначе такое изделие не продать, все будут возвращать.",1,0,0,0
Отличный набор! Очень яркие нитки,1,0,0,0
"Пряжа хорошая дешевле, чем в обычном магазине. Вязать приятно. Пришло 5 мотков, как и было заявлено. Вязала шапку и шарф подружке.",1,0,0,0
"Пришел нерабочий. На выдаче торопилась и не проверила, тк пишут что надо минут 10 ждать, пока нагреется. Дома проверила - вообще не греет. Буду возвращать.",1,0,0,0
"29 декабря 2020 г. дождалась сообщения о прибытии товара и о ЧУДО - вместо ПРЯЖИ прислали КАРТОНКУ с наклейками, как это может быть? Оформили отказ в пункте получения как неправильное вложение, но деньги до сих пор не вернули. Очень разочарована...",1,0,0,0
"Цвет совсем не персиковый, а скорее горчично-жёлтый, но сама пряжа великолепна, мягкая, приятная.",1,0,0,0
"Быстрая доставка, пришли в обычном пакете с застёжкой. Брала специально для приправ. Размер- идеальный! Теперь в специях порядок! Пластиковая баночка с закручивающейся крышечкой. Рекомендую",1,0,0,0
Не работает! На пункте ждали 10 минут и тишина. Очень жаль.,1,0,0,0
